{
    "template_path": ["target/generated-templates", "src/main/resources/templates"],
    "bindings_path": ["src/main/resources/bindings/pg"],
    "output_dir": ".",

    "variableMaps": ["./common-ns.json"],

    "tasks": [
        {
            "type": "instantiate",
            "template": "org/openprovenance/prov/templates/generic/operation",
            "output": "org/openprovenance/prov/templates/pg/pg-capturing",
            "bindings": "pg-capturing.json",
            "formats": ["provn", "png"],
            "hasProvenance": "org/openprovenance/prov/templates/pg/prov/prov-pg-capturing.prov-csv"

        },
        {
            "type": "instantiate",
            "template": "org/openprovenance/prov/templates/generic/operation",
            "output": "org/openprovenance/prov/templates/pg/pg-dropping",
            "bindings": "pg-dropping.json",
            "formats": ["provn", "png"],
            "hasProvenance": "org/openprovenance/prov/templates/pg/prov/prov-pg-dropping.prov-csv"

        },
        {
            "type": "instantiate",
            "template": "org/openprovenance/prov/templates/generic/operation",
            "output": "org/openprovenance/prov/templates/pg/pg-ballcollecting",
            "bindings": "pg-ballcollecting.json",
            "formats": ["provn", "png"],
            "hasProvenance": "org/openprovenance/prov/templates/pg/prov/prov-pg-ballcollecting.prov-csv"

        }
    ]


}


