{
    "template_path": ["target/generated-templates", "src/main/resources/templates"],
    "bindings_path": ["src/main/resources/bindings/ptm"],
    "output_dir": ".",

    "variableMaps": ["./common-ns.json"],

    "tasks": [
        {
            "type": "instantiate",
            "template": "org/openprovenance/prov/templates/generic/parallel2",
            "output": "org/openprovenance/prov/templates/ptm/ptm-expanding",
            "bindings": "ptm-expanding.json",
            "formats": ["provn", "png"],
            "hasProvenance": "org/openprovenance/prov/templates/ptm/prov/prov-ptm-expanding.prov-csv"

        },
        {
            "type": "instantiate",
            "template": "org/openprovenance/prov/templates/generic/product2-2",
            "output": "org/openprovenance/prov/templates/ptm/ptm-merging",
            "bindings": "ptm-merging.json",
            "formats": ["provn", "png"],
            "hasProvenance": "org/openprovenance/prov/templates/ptm/prov/prov-ptm-merging.prov-csv"

        },
        {
            "type": "instantiate",
            "template": "org/openprovenance/prov/templates/generic/parallel2",
            "output": "org/openprovenance/prov/templates/ptm/ptm-mexpanding",
            "bindings": "ptm-mexpanding.json",
            "formats": ["provn", "png"],
            "hasProvenance": "org/openprovenance/prov/templates/ptm/prov/prov-ptm-mexpanding.prov-csv"

        }
    ]
}


